{
 "note": "RO-3a: the body plans every Billie is built on (body-plan-animation.js animates them) and the placeholder Billies baked from them by game/js/logic/sketch-art.js (npm run bake:placeholders). plans: per plan the animation numbers (q) and its bones, each with its parent, its middle in the stage box at rest (c: x, y from the middle of the ground line, y up is negative), its size, its pivot (pv: the joint, as fractions of its box), the shape and tone the placeholder paints, the draw order from the front (z) and from behind (zb), its part slot (rules.json parts.slots; null: none), also (RO-3c: a second slot the same bone answers to where the plan has no bone of its own for it: the octopus's mantle is its body and its head, the blob's body its head; the bone takes its slot's size and is never grafted), a turn at rest (rr, radians), and face (the head with its eyes and blink), squash (the squash and stretch frames), lag (drawn a tick late). A bone with mirror copies another (its middle, pivot and turn mirrored, its picture flipped) with its own fields on top; a bone with size null has no picture. sheet: the drawing sheets (a cell per picture on a magenta ground, a label strip above, pivot ticks on the cell edge). paint: the placeholder look. forms: the placeholder Billies (RO-3b).",
 "sheet": {"bg":[255,0,255],"grid":[60,60,70],"label":9,"room":0.5,"min":12},
 "paint": {"ink":[42,30,46],"hatch":5,"hatchDark":0.82,"dark":0.62,"light":0.5,"back":0.85,"eye":[24,18,28],"glint":[255,255,255]},
 "plans": {
  "biped": {
   "q": {"lift":0,"flapMs":300},
   "bones": [
    {
     "n": "torso",
     "par": "root",
     "c": [0,-26],
     "size": [28,28],
     "pv": [0.5,0.85],
     "shape": "ellipse",
     "tone": "main",
     "z": 5,
     "zb": 5,
     "slot": "body",
     "squash": true
    },
    {
     "n": "legL",
     "par": "torso",
     "c": [-8,-7],
     "size": [9,14],
     "pv": [0.5,0.1],
     "shape": "capsule",
     "tone": "dark",
     "z": 7,
     "zb": 7,
     "slot": "back"
    },
    {"n":"legR","mirror":"legL"},
    {
     "n": "armL",
     "par": "torso",
     "c": [-16,-30],
     "size": [8,16],
     "pv": [0.5,0.12],
     "shape": "capsule",
     "tone": "main",
     "z": 8,
     "zb": 2,
     "slot": "front",
     "rr": 0.25
    },
    {"n":"armR","mirror":"armL"},
    {
     "n": "tail",
     "par": "torso",
     "c": [15,-16],
     "size": [16,8],
     "pv": [0.1,0.5],
     "shape": "taper",
     "tone": "accent",
     "z": 1,
     "zb": 8,
     "slot": "sig",
     "lag": 1
    },
    {
     "n": "head",
     "par": "torso",
     "c": [0,-50],
     "size": [28,24],
     "pv": [0.5,0.9],
     "shape": "ellipse",
     "tone": "main",
     "z": 9,
     "zb": 9,
     "slot": "head",
     "face": true
    }
   ]
  },
  "quad": {
   "q": {},
   "bones": [
    {
     "n": "body",
     "par": "root",
     "c": [2,-24],
     "size": [40,22],
     "pv": [0.5,0.5],
     "shape": "ellipse",
     "tone": "main",
     "z": 5,
     "zb": 5,
     "slot": "body",
     "squash": true
    },
    {
     "n": "legBF",
     "par": "body",
     "c": [12,-8],
     "size": [8,16],
     "pv": [0.5,0.1],
     "shape": "capsule",
     "tone": "dark",
     "z": 3,
     "zb": 7,
     "slot": "back"
    },
    {
     "n": "legFF",
     "par": "body",
     "c": [-10,-8],
     "size": [8,16],
     "pv": [0.5,0.1],
     "shape": "capsule",
     "tone": "dark",
     "z": 3,
     "zb": 7,
     "slot": "front"
    },
    {
     "n": "legBN",
     "par": "body",
     "c": [16,-8],
     "size": [9,16],
     "pv": [0.5,0.1],
     "shape": "capsule",
     "tone": "main",
     "z": 7,
     "zb": 3,
     "slot": "back"
    },
    {
     "n": "legFN",
     "par": "body",
     "c": [-13,-8],
     "size": [9,16],
     "pv": [0.5,0.1],
     "shape": "capsule",
     "tone": "main",
     "z": 7,
     "zb": 3,
     "slot": "front"
    },
    {
     "n": "tail",
     "par": "body",
     "c": [27,-30],
     "size": [16,8],
     "pv": [0.1,0.6],
     "shape": "taper",
     "tone": "accent",
     "z": 4,
     "zb": 8,
     "slot": "sig",
     "lag": 1
    },
    {
     "n": "head",
     "par": "body",
     "c": [-20,-40],
     "size": [24,22],
     "pv": [0.7,0.8],
     "shape": "ellipse",
     "tone": "main",
     "z": 9,
     "zb": 9,
     "slot": "head",
     "face": true
    }
   ]
  },
  "bird": {
   "q": {"per":260,"hop":1.2},
   "bones": [
    {
     "n": "torso",
     "par": "root",
     "c": [0,-24],
     "size": [26,30],
     "pv": [0.5,0.85],
     "shape": "ellipse",
     "tone": "main",
     "z": 5,
     "zb": 5,
     "slot": "body",
     "squash": true
    },
    {
     "n": "legL",
     "par": "torso",
     "c": [-5,-5],
     "size": [5,10],
     "pv": [0.5,0.1],
     "shape": "capsule",
     "tone": "dark",
     "z": 4,
     "zb": 6,
     "slot": "back"
    },
    {"n":"legR","mirror":"legL"},
    {
     "n": "wingL",
     "par": "torso",
     "c": [-16,-26],
     "size": [10,22],
     "pv": [0.5,0.1],
     "shape": "wing",
     "tone": "accent",
     "z": 6,
     "zb": 4,
     "slot": "front"
    },
    {"n":"wingR","mirror":"wingL"},
    {
     "n": "tail",
     "par": "torso",
     "c": [0,-10],
     "size": [18,10],
     "pv": [0.5,0.2],
     "shape": "fan",
     "tone": "accent",
     "z": 3,
     "zb": 8,
     "slot": "sig",
     "lag": 1
    },
    {
     "n": "head",
     "par": "torso",
     "c": [0,-46],
     "size": [22,20],
     "pv": [0.5,0.9],
     "shape": "ellipse",
     "tone": "main",
     "z": 9,
     "zb": 9,
     "slot": "head",
     "face": true
    },
    {
     "n": "crest",
     "par": "head",
     "c": [0,-59],
     "size": [8,10],
     "pv": [0.5,0.95],
     "shape": "tri",
     "tone": "accent",
     "z": 10,
     "zb": 10,
     "slot": null
    }
   ]
  },
  "flyer": {
   "q": {"lift":16,"per":300},
   "bones": [
    {"n":"fly","par":"root","c":[0,-16],"size":null},
    {
     "n": "torso",
     "par": "fly",
     "c": [0,-28],
     "size": [18,22],
     "pv": [0.5,0.5],
     "shape": "ellipse",
     "tone": "main",
     "z": 5,
     "zb": 5,
     "slot": "body",
     "squash": true
    },
    {
     "n": "wingL",
     "par": "torso",
     "c": [-19,-32],
     "size": [24,18],
     "pv": [0.95,0.6],
     "shape": "wing",
     "tone": "accent",
     "z": 3,
     "zb": 7,
     "slot": "front"
    },
    {"n":"wingR","mirror":"wingL"},
    {
     "n": "legL",
     "par": "torso",
     "c": [-4,-14],
     "size": [4,8],
     "pv": [0.5,0.1],
     "shape": "capsule",
     "tone": "dark",
     "z": 6,
     "zb": 4,
     "slot": "back"
    },
    {"n":"legR","mirror":"legL"},
    {
     "n": "tail",
     "par": "torso",
     "c": [0,-14],
     "size": [8,8],
     "pv": [0.5,0.1],
     "shape": "triDown",
     "tone": "accent",
     "z": 4,
     "zb": 8,
     "slot": "sig",
     "lag": 1
    },
    {
     "n": "head",
     "par": "torso",
     "c": [0,-44],
     "size": [18,16],
     "pv": [0.5,0.85],
     "shape": "ellipse",
     "tone": "main",
     "z": 9,
     "zb": 9,
     "slot": "head",
     "face": true
    }
   ]
  },
  "fish": {
   "q": {"lift":12,"bh":8},
   "bones": [
    {"n":"fly","par":"root","c":[0,-14],"size":null},
    {
     "n": "torso",
     "par": "fly",
     "c": [2,-26],
     "size": [34,20],
     "pv": [0.5,0.5],
     "shape": "ellipse",
     "tone": "main",
     "z": 5,
     "zb": 5,
     "slot": "body",
     "squash": true
    },
    {
     "n": "head",
     "par": "torso",
     "c": [-17,-26],
     "size": [16,18],
     "pv": [0.8,0.5],
     "shape": "ellipse",
     "tone": "main",
     "z": 9,
     "zb": 9,
     "slot": "head",
     "face": true
    },
    {
     "n": "tail",
     "par": "torso",
     "c": [23,-26],
     "size": [14,16],
     "pv": [0.05,0.5],
     "shape": "fin",
     "tone": "accent",
     "z": 4,
     "zb": 4,
     "slot": "sig",
     "lag": 1
    },
    {
     "n": "dorsal",
     "par": "torso",
     "c": [4,-39],
     "size": [12,8],
     "pv": [0.5,0.95],
     "shape": "tri",
     "tone": "accent",
     "z": 4,
     "zb": 4,
     "slot": "back"
    },
    {
     "n": "wingL",
     "par": "torso",
     "c": [-2,-17],
     "size": [8,8],
     "pv": [0.5,0.1],
     "shape": "tri",
     "tone": "accent",
     "z": 7,
     "zb": 3,
     "slot": "front"
    },
    {
     "n": "wingR",
     "par": "torso",
     "c": [5,-18],
     "size": [7,7],
     "pv": [0.5,0.1],
     "shape": "tri",
     "tone": "dark",
     "z": 3,
     "zb": 7,
     "slot": "front"
    }
   ]
  },
  "serpent": {
   "q": {"n":3},
   "bones": [
    {
     "n": "coil",
     "par": "root",
     "c": [2,-8],
     "size": [38,16],
     "pv": [0.5,0.5],
     "shape": "ellipse",
     "tone": "main",
     "z": 2,
     "zb": 2,
     "slot": "body",
     "squash": true
    },
    {
     "n": "tail",
     "par": "coil",
     "c": [25,-6],
     "size": [14,8],
     "pv": [0.05,0.5],
     "shape": "taper",
     "tone": "accent",
     "z": 1,
     "zb": 1,
     "slot": "sig",
     "lag": 1
    },
    {
     "n": "n0",
     "par": "coil",
     "c": [-8,-20],
     "size": [12,14],
     "pv": [0.5,0.9],
     "shape": "ellipse",
     "tone": "main",
     "z": 3,
     "zb": 3,
     "slot": "back"
    },
    {
     "n": "n1",
     "par": "n0",
     "c": [-4,-31],
     "size": [11,13],
     "pv": [0.5,0.9],
     "shape": "ellipse",
     "tone": "accent",
     "z": 4,
     "zb": 4,
     "slot": "front"
    },
    {
     "n": "n2",
     "par": "n1",
     "c": [-8,-42],
     "size": [10,12],
     "pv": [0.5,0.9],
     "shape": "ellipse",
     "tone": "main",
     "z": 5,
     "zb": 5,
     "slot": "front"
    },
    {
     "n": "head",
     "par": "n2",
     "c": [-11,-54],
     "size": [20,16],
     "pv": [0.6,0.8],
     "shape": "ellipse",
     "tone": "main",
     "z": 9,
     "zb": 9,
     "slot": "head",
     "face": true
    }
   ]
  },
  "worm": {
   "q": {"n":5},
   "bones": [
    {
     "n": "s4",
     "par": "root",
     "c": [19,-5.5],
     "size": [12,11],
     "pv": [0.5,1],
     "shape": "ellipse",